{
  "version": "1.0.0",
  "createdAt": "2026-07-19",
  "description": "Grafo de dependencias de habilidades lectoras — DAG acíclico para progresión adaptativa",
  "nodes": [
    {
      "id": "oral_vocabulario_basico",
      "domainId": "oral_language",
      "order": 0,
      "prerequisites": [],
      "unlocks": [
        "oral_comprension_instrucciones",
        "oral_estructura_narrativa"
      ]
    },
    {
      "id": "oral_comprension_instrucciones",
      "domainId": "oral_language",
      "order": 1,
      "prerequisites": [
        "oral_vocabulario_basico"
      ],
      "unlocks": [
        "oral_estructura_narrativa"
      ]
    },
    {
      "id": "oral_estructura_narrativa",
      "domainId": "oral_language",
      "order": 2,
      "prerequisites": [
        "oral_vocabulario_basico",
        "oral_comprension_instrucciones"
      ],
      "unlocks": [
        "writing_gramatica_basica"
      ]
    },
    {
      "id": "phonological_rhyme_identification",
      "domainId": "phonological_awareness",
      "order": 0,
      "prerequisites": [],
      "unlocks": [
        "phonological_rhyme_production"
      ]
    },
    {
      "id": "phonological_rhyme_production",
      "domainId": "phonological_awareness",
      "order": 1,
      "prerequisites": [
        "phonological_rhyme_identification"
      ],
      "unlocks": []
    },
    {
      "id": "phonological_syllable_segmentation",
      "domainId": "phonological_awareness",
      "order": 2,
      "prerequisites": [],
      "unlocks": [
        "phonological_syllable_blending"
      ]
    },
    {
      "id": "phonological_syllable_blending",
      "domainId": "phonological_awareness",
      "order": 3,
      "prerequisites": [
        "phonological_syllable_segmentation"
      ],
      "unlocks": []
    },
    {
      "id": "phonological_initial_sound_identification",
      "domainId": "phonological_awareness",
      "order": 4,
      "prerequisites": [],
      "unlocks": [
        "phonological_final_sound_identification"
      ]
    },
    {
      "id": "phonological_final_sound_identification",
      "domainId": "phonological_awareness",
      "order": 5,
      "prerequisites": [
        "phonological_initial_sound_identification"
      ],
      "unlocks": [
        "phonological_phoneme_segmentation"
      ]
    },
    {
      "id": "phonological_phoneme_segmentation",
      "domainId": "phonological_awareness",
      "order": 6,
      "prerequisites": [
        "phonological_final_sound_identification"
      ],
      "unlocks": [
        "phonological_phoneme_blending"
      ]
    },
    {
      "id": "phonological_phoneme_blending",
      "domainId": "phonological_awareness",
      "order": 7,
      "prerequisites": [
        "phonological_phoneme_segmentation"
      ],
      "unlocks": [
        "phonological_manipulation"
      ]
    },
    {
      "id": "phonological_manipulation",
      "domainId": "phonological_awareness",
      "order": 8,
      "prerequisites": [
        "phonological_phoneme_blending"
      ],
      "unlocks": [
        "alphabetic_letter_sound_correspondence"
      ]
    },
    {
      "id": "alphabetic_letter_recognition",
      "domainId": "alphabetic_principle",
      "order": 0,
      "prerequisites": [],
      "unlocks": [
        "alphabetic_letter_sound_correspondence",
        "alphabetic_letter_formation"
      ]
    },
    {
      "id": "alphabetic_letter_sound_correspondence",
      "domainId": "alphabetic_principle",
      "order": 1,
      "prerequisites": [
        "alphabetic_letter_recognition"
      ],
      "unlocks": [
        "alphabetic_letter_formation",
        "decoding_direct_syllables"
      ]
    },
    {
      "id": "alphabetic_letter_formation",
      "domainId": "alphabetic_principle",
      "order": 2,
      "prerequisites": [
        "alphabetic_letter_recognition"
      ],
      "unlocks": [
        "writing_ortografia_fonetica"
      ]
    },
    {
      "id": "decoding_direct_syllables",
      "domainId": "decoding",
      "order": 0,
      "prerequisites": [
        "alphabetic_letter_sound_correspondence"
      ],
      "unlocks": [
        "decoding_inverse_syllables",
        "writing_ortografia_fonetica"
      ]
    },
    {
      "id": "decoding_inverse_syllables",
      "domainId": "decoding",
      "order": 1,
      "prerequisites": [
        "decoding_direct_syllables"
      ],
      "unlocks": [
        "decoding_mixed_syllables"
      ]
    },
    {
      "id": "decoding_mixed_syllables",
      "domainId": "decoding",
      "order": 2,
      "prerequisites": [
        "decoding_inverse_syllables"
      ],
      "unlocks": [
        "decoding_digraphs"
      ]
    },
    {
      "id": "decoding_digraphs",
      "domainId": "decoding",
      "order": 3,
      "prerequisites": [
        "decoding_mixed_syllables"
      ],
      "unlocks": [
        "decoding_consonant_clusters"
      ]
    },
    {
      "id": "decoding_consonant_clusters",
      "domainId": "decoding",
      "order": 4,
      "prerequisites": [
        "decoding_digraphs"
      ],
      "unlocks": [
        "fluency_accuracy"
      ]
    },
    {
      "id": "fluency_accuracy",
      "domainId": "fluency",
      "order": 0,
      "prerequisites": [
        "decoding_direct_syllables"
      ],
      "unlocks": [
        "fluency_speed"
      ]
    },
    {
      "id": "fluency_speed",
      "domainId": "fluency",
      "order": 1,
      "prerequisites": [
        "fluency_accuracy"
      ],
      "unlocks": [
        "fluency_prosody"
      ]
    },
    {
      "id": "fluency_prosody",
      "domainId": "fluency",
      "order": 2,
      "prerequisites": [
        "fluency_speed"
      ],
      "unlocks": [
        "fluency_self_correction"
      ]
    },
    {
      "id": "fluency_self_correction",
      "domainId": "fluency",
      "order": 3,
      "prerequisites": [
        "fluency_prosody"
      ],
      "unlocks": []
    },
    {
      "id": "vocab_significado_palabras",
      "domainId": "vocabulary",
      "order": 0,
      "prerequisites": [
        "oral_vocabulario_basico"
      ],
      "unlocks": [
        "vocab_relaciones_semanticas"
      ]
    },
    {
      "id": "vocab_relaciones_semanticas",
      "domainId": "vocabulary",
      "order": 1,
      "prerequisites": [
        "vocab_significado_palabras"
      ],
      "unlocks": [
        "vocab_morfologia_basica"
      ]
    },
    {
      "id": "vocab_morfologia_basica",
      "domainId": "vocabulary",
      "order": 1,
      "prerequisites": [
        "vocab_relaciones_semanticas"
      ],
      "unlocks": [
        "vocab_estrategias_inferencia"
      ]
    },
    {
      "id": "vocab_estrategias_inferencia",
      "domainId": "vocabulary",
      "order": 2,
      "prerequisites": [
        "vocab_morfologia_basica"
      ],
      "unlocks": [
        "vocab_vocabulario_academico"
      ]
    },
    {
      "id": "vocab_vocabulario_academico",
      "domainId": "vocabulary",
      "order": 3,
      "prerequisites": [
        "vocab_estrategias_inferencia"
      ],
      "unlocks": []
    },
    {
      "id": "comprehension_literal",
      "domainId": "reading_comprehension",
      "order": 0,
      "prerequisites": [
        "decoding_direct_syllables",
        "oral_comprension_instrucciones"
      ],
      "unlocks": [
        "comprehension_inferential_simple"
      ]
    },
    {
      "id": "comprehension_inferential_simple",
      "domainId": "reading_comprehension",
      "order": 1,
      "prerequisites": [
        "comprehension_literal"
      ],
      "unlocks": [
        "comprehension_inferential_complex"
      ]
    },
    {
      "id": "comprehension_inferential_complex",
      "domainId": "reading_comprehension",
      "order": 2,
      "prerequisites": [
        "comprehension_inferential_simple"
      ],
      "unlocks": [
        "comprehension_critical"
      ]
    },
    {
      "id": "comprehension_critical",
      "domainId": "reading_comprehension",
      "order": 3,
      "prerequisites": [
        "comprehension_inferential_complex"
      ],
      "unlocks": [
        "comprehension_metacognitive"
      ]
    },
    {
      "id": "comprehension_metacognitive",
      "domainId": "reading_comprehension",
      "order": 4,
      "prerequisites": [
        "comprehension_critical"
      ],
      "unlocks": [
        "comprehension_text_structure"
      ]
    },
    {
      "id": "comprehension_text_structure",
      "domainId": "reading_comprehension",
      "order": 5,
      "prerequisites": [
        "comprehension_metacognitive"
      ],
      "unlocks": [
        "comprehension_strategies"
      ]
    },
    {
      "id": "comprehension_strategies",
      "domainId": "reading_comprehension",
      "order": 6,
      "prerequisites": [
        "comprehension_text_structure"
      ],
      "unlocks": []
    },
    {
      "id": "writing_ortografia_fonetica",
      "domainId": "writing",
      "order": 0,
      "prerequisites": [
        "decoding_direct_syllables"
      ],
      "unlocks": [
        "writing_ortografia_lexica"
      ]
    },
    {
      "id": "writing_ortografia_lexica",
      "domainId": "writing",
      "order": 1,
      "prerequisites": [
        "writing_ortografia_fonetica"
      ],
      "unlocks": [
        "orthography_reglas_foneticas"
      ]
    },
    {
      "id": "writing_gramatica_basica",
      "domainId": "writing",
      "order": 2,
      "prerequisites": [
        "oral_estructura_narrativa"
      ],
      "unlocks": [
        "writing_composicion"
      ]
    },
    {
      "id": "writing_composicion",
      "domainId": "writing",
      "order": 3,
      "prerequisites": [
        "writing_gramatica_basica"
      ],
      "unlocks": [
        "writing_revision"
      ]
    },
    {
      "id": "writing_revision",
      "domainId": "writing",
      "order": 4,
      "prerequisites": [
        "writing_composicion"
      ],
      "unlocks": [